{"format":"chalk.streamed","streamVersion":1,"formatVersion":10,"id":"lesson_conformance","title":"Conformance","locale":"bn","createdAt":"2026-01-01T00:00:00.000Z","updatedAt":"2026-01-01T00:00:00.000Z","pages":[{"id":"p1","file":"pages/1-7426dae3.json","title":"p1","bytes":1952,"assets":["c1:jf3zbfd5izthmdhdr46ab2csy4","c1:coilbff3mf2zxa37zmewz5j7je","c1:6ka3wp2wdbp6dzuau5iwyecdza"],"assetBytes":70}],"assets":[{"id":"c1:jf3zbfd5izthmdhdr46ab2csy4","type":"image/png","size":70,"path":"assets/c1_jf3zbfd5izthmdhdr46ab2csy4"},{"id":"c1:coilbff3mf2zxa37zmewz5j7je","type":"model/gltf-binary","size":49,"path":"assets/c1_coilbff3mf2zxa37zmewz5j7je"},{"id":"c1:6ka3wp2wdbp6dzuau5iwyecdza","type":"text/html","size":8533,"path":"assets/c1_6ka3wp2wdbp6dzuau5iwyecdza"}]}